{
  "description": "",
  "language": "en",
  "disableInteractionLogs": false,
  "disableStackdriverLogs": false,
  "googleAssistant": {
    "googleAssistantCompatible": false,
    "welcomeIntentSignInRequired": false,
    "startIntents": [],
    "systemIntents": [],
    "endIntentIds": [],
    "oAuthLinking": {
      "required": false,
      "grantType": "AUTH_CODE_GRANT"
    },
    "voiceType": "MALE_1",
    "capabilities": [],
    "protocolVersion": "V2",
    "autoPreviewEnabled": false,
    "isDeviceAgent": false
  },
  "webhook": {
    "url": "",
    "headers": {},
    "available": true,
    "useForDomains": false,
    "cloudFunctionsEnabled": false,
    "cloudFunctionsInitialized": false
  },
  "isPrivate": true,
  "customClassifierMode": "use.after",
  "mlMinConfidence": 0.3,
  "supportedLanguages": [
    "en",
    "en-us"
  ],
  "onePlatformApiVersion": "v2",
  "analyzeQueryTextSentiment": false
}